{
  "$schema": "https://raw.githubusercontent.com/dvdmrtnz15-afk/SkillAx/main/sentinel/schemas/sentinel-policy.v1.schema.json",
  "schema": "truenorth.sentinel.policy.v1",
  "profile": "baseline",
  "enforcement": "audit",
  "max_file_bytes": 5242880,
  "sensitive_globs": [],
  "required_evidence": []
}
